;;;;;;;;;;;;;;;;;;;Test Design technique;;;;;;;;;;;;;;;;;;;;;;;;;Testing Practice;;;;;;;;;;;;Testing level;;;;;;Testing Type;;;;;;;;;;;;;;;;;;;
Country;Geographic Area;University;Degree Name;Degree Level;Link to degree page;Course Name;Course Year;Link;Scientific Field;#EC;Type;#Hours;Theory Hours;Lab Hours;Focus on Testing;Assessment Methods;Language;Reference Books;Specification Based; Equivalence Partitioning; Classification tree method; Boundary value analysis; Syntax testing; Combinatorial testing; Decision table testing; Cause-effect graphing; State transition testing; Scenario testing; Use case testing; Random testing; Metamorphic testing; Requirements-based testing; Structure Based; Statement testing; Branch testing; Decision testing; Branch condition testing; Branch condition combination testing;MC/DC testing; Data flow testing; Experience Based; Error guessing;Other;Model-based testing; Scripted testing; Exploratory testing; Experience-based testing; Manual testing;A/B testing; Back-to-back testing; Mathematical-based testing; Fuzz testing; Keyword-driven testing; Automated testing;Other;Unit testing; Integration testing; System testing; System integration testing; Acceptance testing; Other;Functional testing; Accessibility testing; Compatibility testing; Conversion testing;Disaster recover testing; Installability testing; Interoperability testing; Localization testing; Maintainability testing; Performance related testing; Portability testing; Procedure testing; Reliability testing; Security testing; Usability testing; Other;;;;
;EU/America/Asia/Other;;;Bachelor/Laurea/Other;;;;;CS/CE/other;;Theory/Lab/Both;;;;ST /NST;Open questions/Closed questions/Exercises/Homeworks/Project/Discussion;;;;;;;;;;;;;;;;;;;;;;;;;;;;;;;;;;;;;;;;;;;;;;;;;;;;;;;;;;;;;;;;;
Belgium;EU;UAntwerpen;Master of Computer Science: Software Engineering;Master;https://www.uantwerpen.be/en/study/programmes/all-programmes/master-software-engineering/study-programme/;Software testing;1;https://ansymore.uantwerpen.be/courses/software-testing;CS;6;Both;45;6;16;ST;Open questions,Project;English;Software Testing: A Craftsman’s Approach, Fourth Edition 4th Edition by Paul C. Jorgensen & Practical Test Design: Selection of traditional and automated test design techniques by István Forgács, Attila Kovács;X;;;;;;;;;;;;;;X;;;;;;;;;;;;;;;;;;;;;;;;;;;;;;;;;;;;;;;;;;;;;;;;
Italy;EU;Milano Bicocca unimib;Computer Science;Master;https://elearning.unimib.it/course/index.php?categoryid=8961;Software Quality;1;https://elearning.unimib.it/course/info.php?id=44607;CS;6;Both ;52;N/A;N/A;ST;Written Exercises,Discussion;English;Mauro Pezzè and Michal Young, Software Testing and Analysis, process, principle and techniques, John Wiley 2007;X;X;;;X;;X;;X;;;X;;;X;X;X;X;X;X;;X;;;x;X;;;;;;;;;;;;X;X;X;X;X;;X;;;;;;;;;;;;;;;;;;;
Italy;EU;Napoli unina;ComputerEngineering;Master;https://www.ingegneria-informatica.unina.it/index.php/it/corsi-di-laurea/laurea-magistrale-m63/insegnamenti-m63/2-non-categorizzato/297-insegnamenti-m63-2223;Software Testing;1;https://www.ingegneria-informatica.unina.it/index.php/it/corsi-di-laurea/laurea-magistrale-m63/insegnamenti-m63/15-insegnamenti-lm/322-soft-test;CE;6;Both;48;36;12;ST;Project,Discussion;English;Ammann and Offutt, Introduction to Software Testing;X;X;;X;;X;X;X;;;;X;;X;X;X;X;X;X;X;X;;X;;;X;X;X;X;X;;;;X;;X;;X;X;X;;X;;X;;;;;;;;;;;;;;;;;;;
Italy;EU;Firenze unifi;Computer Science;Master;https://www.informaticamagistrale.unifi.it/vp-95-insegnamenti.html;Advanced Programming Techniques;1;https://www.informaticamagistrale.unifi.it/p-ins2-2022-632203-1.html;CS;6;Both;48;N/A;N/A;ST;Homework,Discussion;English;N/A;;;;;;;;;;;;;;;;;;;;;;;;;;;;;;;;;;;;X;x;X;;X;;;;X;;;;;;;;;;;;;;;;;;;
Portugal;EU;University of Porto ;"Master in Software Engineering
Master in Informatics and Computing Engineering ";Master;"https://sigarra.up.pt/feup/en/CUR_GERAL.CUR_VIEW?pv_ano_lectivo=2023&pv_origem=CUR&pv_tipo_cur_sigla=M&pv_curso_id=10861
https://sigarra.up.pt/feup/en/CUR_GERAL.CUR_VIEW?pv_ano_lectivo=2023&pv_origem=CUR&pv_tipo_cur_sigla=M&pv_curso_id=22862
";Software Testing, Verification and Validation;2;"https://sigarra.up.pt/feup/en/ucurr_geral.ficha_uc_view?pv_ocorrencia_id=518488
https://sigarra.up.pt/feup/en/UCURR_GERAL.FICHA_UC_VIEW?pv_ocorrencia_id=518845
";CE;6;Both;42;19,5;19,5;ST;"Exercises,
Project,Open questions";English;"Aditya P. Mathur; Foundations of Software Testing, 2013. ISBN: 9789332517660
Maurício Aniche; Effective software testing, 2022. ISBN: 978-1-633-43993-1
Paul Ammann; Introduction to software testing. ISBN: 978-1-107-17201-2
Mark Utting; Practical Model-Based Testing, 2007. ISBN: 978-0-12-372501-1
Paul C. Jorgensen; Software Testing A Craftsman's Approach, 2013. ISBN: 978-1-466-56069-7
Dorothy Graham, Rex Black, Erik van Veenendaal; Foundations of Software Testing: ISTQB Certification, 2020. ISBN: 978-1-473-76479-8
Ilene Burnstein; Practical Software Testing, 2003. ISBN: 978-0-387-95131-7
Gordon Fraser and José Miguel Rojas; Software Testing, 2019. ISBN: 978-3-030-00262-6
Tomek Kaczanowski; Bad Tests, Good Tests, 2013. ISBN: 978-8-393-84713-6
Kent Beck; Test Driven Development: By Example, 2002. ISBN: 978-0-321-14653-3
Petar Tahchiev, Felipe Leme, Vincent Massol, and Gary Gregory; JUnit 4.8 In Action, 2010. ISBN: 978-1-935-18202-3
Chak Shun Yu, Christoph Treude, Maurício Aniche; Comprehending Test Code: An Empirical Study, 2019. ISBN: 978-1-7281-3095-8
Michal Young and Mauro Pezzè; Software testing and analysis: process, principles, and techniques, 2008. ISBN: 978-0-471-45593-6";x;x;;x;;x;x;x;x;;;x;;;x;x;x;x;x;x;x;x;;;x;x;x;;;x;;;;;;x;;x;x;x;x;x;;x;;;;;;;;;;;;;;;x;;;;
Portugal;EU;Instituto Superior Técnico, University of Lisbon;Master in Computer Science and Engineering;Master;https://fenix.tecnico.ulisboa.pt/cursos/meic-a;Software Testing and Validation;1;https://fenix.tecnico.ulisboa.pt/cursos/meic-a/disciplina-curricular/564478961778811;CE;6;Both ;49;28;21;ST;Open questions,Project ;English;"Recommended Bibliography
Software Testing: A Craftsman's Approach, 4th edition.  : Paul Jorgensen 2013 Auerbach Publications
Testing Object-Oriented Systems: Models, Patterns, and Tools";x;x;;x;;;x;;x;;;x;;;x;x;x;x;x;x;x;x;;;x;;;;;;;;;;;x;;x;x;x;;;;;;;;;;;;;x;;;;x;;x;;;;
Portugal;EU;University of Coimbra;Master in Informatics Engineering;Master;https://apps.uc.pt/courses/EN/programme/5041/2022-2023?id_branch=20326;Software Quality and Dependability;1;https://apps.uc.pt/courses/EN/unit/79302/20326/2023-2024?type=ram&id=5041;CE;6;Both ;N/A;N/A;N/A;ST;Open questions,Project;"English
Portuguese";- Paul Ammann and Jeff Offutt, ―Introduction to Software Testing‖, Cambridge University Press, 2008. - Mordechai Ben-Ari, ―Principles of the Spin Model Checker‖, Springer, 2008. - Stephen H. Kan, ―Metrics and Models in Software Quality Engineering‖, Addison-Wesley Professional, 2003. - Mordechai Ben-Menachem, Garry S. Marliss, ―Software Quality: Producing Practical, Consistent Software‖, International Thomson Computer Press, 1997.;X;;;;;;;;;;;;;;X;;;;;;;;;;;X;;;;;;;;;;;;X;X;X;;;;;;;;;;;;;;;;;;;;;;;
Portugal;EU ;University of Coimbra;Master in Software Engineering;Master;https://apps.uc.pt/courses/EN/course/10162/2023-2024;Analysis of Software Artifacts;1;https://apps.uc.pt/courses/EN/unit/89048/22524/2023-2024?common_core=true&type=ram&id=10162;CE;6;Both;N/A;N/A;N/A;ST;Project,Discussion;"English
Portuguese";"Design Patterns Explained;

Buechner, Test Case Design Using the Classification Tree

Method; Conrad, A Systematic Approach to Testing Automotive Control Software.";x;X;;X;;X;;;;;;;;;X;;;;;;;X;;;x;;;;;;;;X;;;;;;;;;;;;;;;;;;;;;;;;;;;;;;
Portugal;EU ;University of Coimbra;Masters in Informatics Security;Master;https://apps.uc.pt/courses/EN/programme/7281/2023-2024?id_branch=18601#branch-18601;Design and Development of Secure Software;1;https://apps.uc.pt/courses/EN/unit/85443/18601/2023-2024?common_core=true&type=ram&id=7281;CE;6;Both;N/A;N/A;N/A;NSt;Project,Discussion;"Portuguese
English";;;;;;;;;;;;;;;;;;;;;;;;;;;;;;;;;;;;;;;;;;;;;;;;;;;;;;;;;;X;;;;;;
Spain;EU;UPV;Computer science;Master;http://www.upv.es/titulaciones/MUITSS/indexc.html;Software testing;2;http://www.upv.es/titulaciones/MUITSS/menu_1013904c.html;CS;2;both;20;10;10;ST;Project;Spanish;Structured software testing. T. Vos and  N. van Vugt-Hage;X;x;x;x;;x;x;;x;;;;;;;;;;;;;;;;;x;;x;;x;;;;;;;;;;;;;x;;;;;;;;;;;;;;;;;;;;
Spain;EU;Universidad Politécnica de Madrid;Computer Science;Master;https://muss.fi.upm.es/index.php;Software validation and verification;1;https://muss.fi.upm.es/asigVVS.php;CS;4;both;40;32;8;ST;Open Questions,Written Exercises;English;"B. Beizer: ""Software Testing Techniques"", 2ª Edición. 1990.
G. J. Myers: ""The Art of Software Testing"", 2ª Edición. Wiley. 2004.
P. C. Jorgensen: ""Software Testing. A Craftsman’s Approach"". CRC Press, 1995.
C. Kaner, J. Falk, H. Q. Nguyen: ""Testing Computer Software"". Wiley, 1999.
W. E. Perry: ""Effective methods for software testing"". 3ª edición. Wiley. 2006.";;;;;;;;;;;;;;;;;;;;;;;;;;;;;;;;;;;;x;;;;;;;x;;;;;;;;;;;;;;;;;;;;
Portugal;EU;Universidade de Aveiro;1st cycle degree in Informatics Engineering;Bachelor;https://www.ua.pt/en/course/383;Software Testing and Quality Control;3;https://www.ua.pt/en/uc/8109;CS;6;Both;45;15;30;ST;Open questions,Project ;Portuguese/English;"P. Farrell-Vinay, Manage Software Testing: Taylor & Francis, 2008. [Livro eletrónico, só para a rede da UA]
J. Humble and D. Farley, Continuous Delivery: Reliable Software Releases through Build, Test, and Deployment Automation: Pearson Education, 2010.
S. Naik and P. Tripathy, Software Testing and Quality Assurance: Theory and Practice, Wiley, 2008. 
J. Bloch, Effective Java, 2nd ed.: Addison-Wesley Professional, 2008.
R. Martin, Clean Code: A Handbook of Agile Software Craftsmanship. Prentice Hall; 2008.
R. Pressman and B. Maxim, Software Engineering: A Practitioner’s Approach, 8th ed. McGraw-Hill Science/Engineering/Math, 2014.";;;;;;;;;;;;;;;x;;;;;;;;;;;;;;;;;;;;;X;;X;X;X;;;;;;;;;;;;;X;;;;;;;;;;
Spain;EU;Univ Oviedo;Computer science;Bachelor;https://www.uniovi.es/-/grado-en-ingenieria-informatica-en-tecnologias-de-la-informacion-2014;Software Quality, Validation and Verification;4;https://www.uniovi.es/estudia/grados/ingenieria/informaticasoftware/-/fof/asignatura/GIISOF01-4-003;CS;6;both;60;32;28;ST;Project,Discussion;Spanish;"Glenford J. Myers. The Art of Software Testing. Wiley (1979, 2004, 2011)
ISO/IEC/IEEE 29119-1:2015 Software and systems engineering — Software testing — Part 3: Test Techniques (2015)
Lisa Crispin, Janet Gregory. Agile Testing: A Practical Guide for Testers and Agile Teams. Addison-Wesley (2008)
Erik Van Veenendaal, Dorothy Graham, Rex Black. Foundations of Software Testing: ISTQB Certification. Cengage Learning (2019)";x;;;;;;;;;;;;;;x;;;;;;;;;;;;;;;;;;;;;x;;;;;;;x;;;;;;;;;;;;;;;;x;;;;
Italy;EU;Torino unito;Computer Science;Master;http://magistrale.educ.di.unito.it/index.php/offerta-formativa/insegnamenti/elenco-completo/elenco-completo?anno=2022;Istituzioni di Sviluppo Software;1;https://magistrale.informatica.unito.it/do/corsi.pl/Show?_id=lftb;CS;6;Both;56;16;40;NSt;Discussion;Italian;;X;;;;;;;;;;;;;;;;;;;;;;;;;;;;;;;;;;;;;;;;;;;X;;;;;;;;;;;;;;;;;;;
Portugal;EU;University of Porto ;Master in Software Engineering;Master;https://sigarra.up.pt/feup/en/cur_geral.cur_view?pv_curso_id=10861&pv_ano_lectivo=2022;Software Engineering Laboratory;1;https://sigarra.up.pt/feup/en/ucurr_geral.ficha_uc_view?pv_ocorrencia_id=518489;CE;6;Both ;42;14;28;NSt;Project;English;;;;;;;;;;;;;;;;;;;;;;;;;;;;;;;;;;;;;;x;x;;;;x;;;;;;;;;;;;;;;;;;;;;
Portugal;EU;Universidade do Minho;Bachelor in Informatics Engineering;Bachelor;https://web.di.uminho.pt/sitedi/enginf/;Informatics Laboratories I;1;https://www4.di.uminho.pt/~jno/sitedi/uc_J301N6.html;CE;5;Lab;30;N/A;30;NSt;Project;N/A;;;;;;;;;;;;;;;;;;;;;;;;;;;;;;;;;;;;;;;X;;;;;;;;;;;;;;;;;;;;;;;;;
Portugal;EU;Universidade do Minho;Bachelor in Informatics Engineering;Bachelor;https://web.di.uminho.pt/sitedi/enginf/;Object Oriented Programming;2;https://www4.di.uminho.pt/~jno/sitedi/uc_J304N2.html;CE;5;Both ;60;30;30;NSt;Open questions,Project ;NA;;;;;;;;;;;;;;;;;;;;;;;;;;;;;;;;;;;;;;;X;;;;;;;;;;;;;;;;;;;;;;;;;
Portugal;EU;Universidade do Minho;Bachelor in Informatics Engineering;Bachelor;https://web.di.uminho.pt/sitedi/enginf/;Software Systems Development;3;https://www4.di.uminho.pt/~jno/sitedi/uc_J305N2.html;CE;5;Both ;60;30;30;NSt;Open questions,Project ;N/A;;;;;;;;;;;;;;;;;;;;;;;;;;;;;;;;;;;;;;;;;;;X;;;;;;;;;;;;;;;;;;;;;
Portugal;EU;Universidade do Minho;Masters in Informatics Engineering;Master;https://web.di.uminho.pt/sitedi/meinf/;Security Engineering;1;https://www4.di.uminho.pt/~jno/sitedi/uc_ME78ME7800006096.html;CE;5;Both ;45;15;30;NSt;Project,Discussion;English;;;;;;;;;;;;;;;;x;;;;;;;;;;;;;;;;;;;;;;;;;;;;;;;;;;;;;;;;;;X;;;;;;
Portugal;EU;Universidade do Minho;"Masters in Mathematics and Computation
Master in Informatics Engineering
";Master;"https://www.ecum.uminho.pt/pt/Ensino/Paginas/mestrados/Mestrado-em-Matematica-e-Computacao.aspx
https://www.uminho.pt/EN/education/educational-offer/_layouts/15/UMinho.PortalUM.UI/Pages/CatalogoCursoDetail.aspx?itemId=4711&catId=14";Security Technologies;1;https://www.ecum.uminho.pt/en/Ensino/Pages/masters/Master-Degree-in-Mathematics-and-Computation.aspx;CS;5;Both ;45;15;30;NSt;Project,Discussion;English;;;;;;;;;;;;;;;;;;;;;;;;;;;;;;;;;;;;;;;;;;;;;;;;;;;;;;;;;;X;;;;;;
Portugal;EU;Universidade do Minho;Masters in Information Systems;Master;https://www.uminho.pt/pt/ensino/oferta-educativa/_layouts/15/uminho.portalum.ui/pages/catalogocursodetail.aspx?itemid=3699&catid=11;Testing and Validation of Information Systems;1;https://www.uminho.pt/en/education/educational-offer/cursos-conferentes-a-grau/_layouts/15/uminho.portalum.ui/pages/catalogocursodetail.aspx?itemid=4359&catid=13;CE;5;Both ;30;N/A;N/A;ST;Project,Discussion;NA;"Essential bibliography
ISTQB. (2018). “Certified Tester Foundation Level Syllabus”. 

ISTQB (International International Software Testing Qualifications Board). (2015). “Standard glossary of terms used in Software Testing”. 

ISO/IEC/IEEE 29119-3: Test Documentation.

IEEE Computer Society (2014). Guide to the software engineering body of knowledge version 3.0. Retrieved from www.swebok.org .

Ordem dos Engenheiros, C. N. do C. de E. I. (2013). Actos de Engenharia Informática. 

Anderson, L. W. and Krathwohl, D. R. (eds) (2001) A Taxonomy for Learning, Teaching, and Assessing: A Revision of Bloom's Taxonomy of Educational Objectives, Allyn & Bacon.";X;;;;;;;;;;;;;;X;;;;;;;;X;;;;;;;;;;;;;;x;;;;;;x;;;;;;;;;;;;;;;;;;;;
Portugal;EU;Universidade do Minho;Masters in Engineering and Management of Information Systems;Master;https://www.uminho.pt/PT/ensino/oferta-educativa/Cursos-Conferentes-a-Grau/_layouts/15/UMinho.PortalUM.UI/Pages/CatalogoCursoDetail.aspx?itemId=4712&catId=14;Information Systems Security Engineering;1;https://www.uminho.pt/EN/education/educational-offer/Cursos-Conferentes-a-Grau/_layouts/15/UMinho.PortalUM.UI/Pages/CatalogoCursoDetail.aspx?itemId=4712&catId=14;CE;5;Both ;30;N/A;N/A;NSt;Exercises,Discussion;NA;;;;;;;;;;;;;;;;;;;;;;;;;;;;;;;;;;;;;;;;;;;;;;;;;;;;;;;;;;X;;;;;;
Portugal;EU;Universidade do Minho;Masters in Telecommunications and Informatics Engineering;Master;https://www.uminho.pt/PT/ensino/oferta-educativa/Cursos-Conferentes-a-Grau/_layouts/15/UMinho.PortalUM.UI/Pages/CatalogoCursoDetail.aspx?itemId=4721&catId=14;Cybersecurity;1;https://www.uminho.pt/PT/ensino/oferta-educativa/Cursos-Conferentes-a-Grau/_layouts/15/UMinho.PortalUM.UI/Pages/CatalogoCursoDetail.aspx?itemId=4721&catId=14;CE;5;Both ;45;15;30;NSt;Exercises,Discussion,Open Questions;NA;;;;;;;;;;;;;;;;;;;;;;;;;;;;;;;;;;;;;;;;;;;;;;;;;;;;;;;;;;x;;;;;;
Portugal;EU;ISCTE Instituto Universitário de Lisboa;"Computer Science Engineering
Computer Science and Business Management
Telecommunications and Computer Engineering ";Bachelor;"https://www.iscte-iul.pt/curso/3/licenciatura-engenharia-informatica/planoestudos
https://www.iscte-iul.pt/course/6/bachelor-bsc-in-computer-science-and-business-management/studyplan";Software Engineering;3;https://fenix.iscte-iul.pt/disciplinas/03712/2023-2024/2-semestre/fuc?locale=pt;CE;6;Both;54;18;36;NSt;Open questions,Project;Portuguese;;;;;;;;;;;;;;;;X;;;;;;;;;;;;;;;;;;;;;X;;X;;;;;;;;;;;;;;;;;;;;;;;;;
Portugal;EU ;ISCTE Instituto Universitário de Lisboa;Software and Applications Development;Bachelor;https://www.iscte-iul.pt/course/378/bachelor-bsc-in-software-and-applications-development;Agile Software Development;2;https://fenix.iscte-iul.pt/disciplinas/04124/2023-2024/1-semestre/fuc?locale=en_EN_ISCTE;CE;6;Lab;36;N/A;36;NSt;Exercises,Project;Portuguese;;;;;;;;;;;;;;;;x;;;;;;;;;;;;;;;;;;;;;;;X;X;;;;;X;;;;;;;;;X;;;;;;;;;;
Italy;EU;Roma Sapienza;Bachelor’s Degree in Computer and System Engineering;Bachelor;https://corsidilaurea.uniroma1.it/en/corso/2022/31810/cds;SOFTWARE DESIGN ;2;https://corsidilaurea.uniroma1.it/en/view-course-details/2020/29931/20200313105820/2c733758-4500-4495-adc3-0cd4ecb4e63f/6571e24f-3bd9-4ec0-a807-eb4b035869d9/db30f5ea-ca15-4af1-9b2e-7cd657d522ac/d9d177c0-4a2e-40a2-9f99-280747f94cce?guid_cv=6571e24f-3bd9-4ec0-a807-eb4b035869d9&current_erogata=2c733758-4500-4495-adc3-0cd4ecb4e63f;CE;9;Both;100;32;68;NSt;N/A;Italian;;;;;;;;;;;;;;;;;;;;;;;;;;;;X;;;;;;;;;;;X;;;;;;X;;;;;;;;;;;;;;;;;;;
Italy;EU;Torino Politecnico polito;Computer Engineering;Bachelor;https://didattica.polito.it/pls/portal30/sviluppo.offerta_formativa_2019.vis?p_a_acc=2023&p_sdu=37&p_cds=3;Object Oriented Programming;2;https://didattica.polito.it/pls/portal30/gap.pkg_guide.viewGap?p_cod_ins=09CBIOA&p_a_acc=2023&p_header=S&p_lang=&multi=N;CE;8;Both ;98;N/A;N/A;NSt;Open Questions;Italian;;;;;;;;;;;;;;;;;;;;;;;;;;;;;;;;;;;;;;;X;;;;;;;;;;;;;;;;;;;;;;;;;
Italy;EU;Torino Politecnico polito;Computer Engineering;Bachelor;https://didattica.polito.it/pls/portal30/sviluppo.offerta_formativa_2019.vis?p_a_acc=2023&p_sdu=37&p_cds=3;Object Oriented Programming;2;https://didattica.polito.it/pls/portal30/gap.pkg_guide.viewGap?p_cod_ins=09CBIOA&p_a_acc=2023&p_header=S&p_lang=&multi=N;CE;8;Both ;98;N/A;N/A;NSt;Open Questions;Italian;;;;;;;;;;;;;;;;;;;;;;;;;;;;;;;;;;;;;;;X;;;;;;;;;;;;;;;;;;;;;;;;;
Italy;EU;Torino Politecnico polito;Computer Engineering;Bachelor;https://didattica.polito.it/pls/portal30/sviluppo.offerta_formativa_2019.vis?p_a_acc=2023&p_sdu=37&p_cds=3;Object Oriented Programming;2;https://didattica.polito.it/pls/portal30/gap.pkg_guide.viewGap?p_cod_ins=04JEYOA&p_a_acc=2023&p_header=S&p_lang=&multi=N;CE;8;Both ;98;N/A;N/A;NSt;Open Questions;English;;;;;;;;;;;;;;;;;;;;;;;;;;;;;;;;;;;;;;;X;;;;;;;;;;;;;;;;;;;;;;;;;
Portugal;EU;Faculty of Sciences, University of Lisbon ;Bachelor Programme in Informatics Engineering;Bachelor;https://fenix.ciencias.ulisboa.pt/degrees/engenharia-informatica-564500436615278;Programming labs;1;https://fenix.ciencias.ulisboa.pt/degrees/engenharia-informatica-564500436615278/disciplina-curricular/564680825258165  ;CE;6;Lab;39;0;39;NSt;Exercises;N/A;;;;;;;;;;;;;;;;;;;;;;;;;;;;;;;;;;;;;;;x;;;;;;;;;;;;;;;;;;;;;;;;;
Portugal;EU;Instituto Superior Técnico, University of Lisbon;Undergraduate in Computer Science and Engineering;Bachelor;https://fenix.tecnico.ulisboa.pt/cursos/leic-a;Software Engineering ;3;https://fenix.tecnico.ulisboa.pt/cursos/leic-a/disciplina-curricular/845953938489555 ;CE;6;Both ;;N/A;N/A;NSt;Open questions,Project;N/A;;;;;;;;;;;;;;;;x;x;;;;;;;;;;;;;;;;;;;;x;x;x;x;x;;;;;;;;;;;;;x;;;;;;;;;;
Spain;EU ;Universitat Politecnica de Catalunya;Computer Science;Bachelor;https://www.fib.upc.edu/es/estudios/grados/grado-en-ingenieria-informatica;Software Architecture;3;https://www.fib.upc.edu/es/estudios/grados/grado-en-ingenieria-informatica/plan-de-estudios/asignaturas/AS;CS;6;both;60;30;30;NSt;Exercises,Discussion;Spanish;Test-driven development: by example - Beck, K, Addison-Wesley , 2003. ISBN: 0321146530 ;;;;;;;;;;;;;;;;;;;;;;;;;;;;;;;;;;;;;x;;;;;;;;;;;;;;;;;;;;;;;;;;
Spain;EU ;Universitat Politecnica de Catalunya;Computer Science;Bachelor;https://www.fib.upc.edu/es/estudios/grados/grado-en-ingenieria-informatica;Software Architecture;3;https://www.fib.upc.edu/es/estudios/grados/grado-en-ingenieria-informatica/plan-de-estudios/asignaturas/AS;CS;6;both;60;30;30;NSt;Exercises,Discussion;Spanish;Test-driven development: by example - Beck, K, Addison-Wesley , 2003. ISBN: 0321146530 ;;;;;;;;;;;;;;;;;;;;;;;;;;;;;;;;;;;;;x;;;;;;;;;;;;;;;;;;;;;;;;;;
Spain;EU ;Universitat Politecnica de Catalunya;Computer Science;Bachelor;https://www.fib.upc.edu/es/estudios/grados/grado-en-ingenieria-informatica;Software Architecture;3;https://www.fib.upc.edu/es/estudios/grados/grado-en-ingenieria-informatica/plan-de-estudios/asignaturas/AS;CS;6;both;60;30;30;NSt;Exercises,Discussion;Spanish;Test-driven development: by example - Beck, K, Addison-Wesley , 2003. ISBN: 0321146530 ;;;;;;;;;;;;;;;;;;;;;;;;;;;;;;;;;;;;;x;;;;;;;;;;;;;;;;;;;;;;;;;;
Italy;EU;Verona univr;Computer Science and Engineering;Master;https://www.corsi.univr.it/?ent=cs&id=417&menu=Home&lang=it;Software Engineering Fundamentals;1;https://www.corsi.univr.it/?ent=cs&aa=2022%2F2023&codiceCs=S71&codins=4S008899&discr=&discrCd=&id=417&menu=Studiare&tab=Insegnamenti&lang=it;CE;6;Both ;48;40;8;NSt;Homework,Project,Discussion;Italian;;X;;;;;;;;;;;;;;X;X;X;X;;;;;;;x;;;;;;;;;;;;;X;X;X;;;;X;;;;;;;;;;;;;;;;;;;
Italy;EU;Genova unige;Computer Science;Master;https://servizionline.unige.it/unige/stampa_manifesto/MF/2020/10852.html;Functional and Security Testing Techniques;1;https://corsi.unige.it/en/off.f/2020/ins/43801;CS;6;Both;48;N/A;N/A;NSt;Homework,Discussion;English;;X;;;;;;;;;;;;;;X;;;;;;;;;;;;;X;;X;;;;;;X;x;X;;X;;;x;X;;;;;;;;;;;;;X;;;;;;
Italy;EU;Genova unige;Computer Engineering;Master;https://servizionline.unige.it/unige/stampa_manifesto/MF/2021/11160.html;Software Engineering;1;https://corsi.unige.it/en/off.f/2021/ins/51469?codcla=11160;CE;9;Both;72;N/A;N/A;NSt;Homework,Discussion;English;;X;;;;;;;;;;;;;;X;X;;;;;;;;;;;;;;;;;;;;;;;;;;;;X;;;;;;;;;;;;;;;;;;;
Italy;EU;Milano polimi;Computer Engineering;Master;https://www.polimi.it/corsi/corsi-di-laurea-magistrale/M/2022-ing-ind-inf-magord-270-mi-481-computer-science-and-engineering-ingegneria-informatica;Software Engineering 2;1;https://www4.ceda.polimi.it/manifesti/manifesti/controller/ManifestoPublic.do?EVN_DETTAGLIO_RIGA_MANIFESTO=evento&aa=2022&k_cf=225&k_corso_la=481&k_indir=T2A&codDescr=054443&lang=IT&semestre=1&anno_corso=1&idItemOfferta=161169&idRiga=286941;CE;5;Both;50;30;20;NSt;Project,Open Questions,Discussion;English;;X;;;;;;;;;;;;;;;;;;;;;;;;;;;;;;;;;;;;;;;;;;;X;;;;;;;;;;;;;;;;;;;
Italy;EU;Torino Politecnico polito;Computer Engineering;Master;https://didattica.polito.it/pls/portal30/sviluppo.offerta_formativa_2019.vis?p_a_acc=2023&p_sdu=37&p_cds=18;Software Engineering;1;https://didattica.polito.it/pls/portal30/gap.pkg_guide.viewGap?p_cod_ins=05BIDOV&p_a_acc=2023&p_header=S&p_lang=&multi=N;CE;8;Both ;80;N/A;N/A;NSt;Open questions;Italian;;X;;;;;;;;;;;;;;X;;;;;;;;;;;;;;;;;;;;;;;?;;;;;;?;;;;;;;;;;;;;;;;;;;
Italy;EU;Napoli unina;Computer Science;Master;https://informatica.dieti.unina.it/index.php/it/laurea-magistrale/insegnamenti;Software Project Management and Evolution;1;https://informatica.dieti.unina.it/index.php/it/laurea-magistrale/insegnamenti/42-laurea-magistrale/insegnamenti-lm/76-software-project-management-and-evolution;CS;6;Both;48;N/A;N/A;NSt;Project,Discussion;Italian;;X;;;;;;;;;;;;;;X;X;X;X;;;;;;;;;;;;;;;;;;X;;;X;X;;X;;;;;;;;;;;;;;;;;;;;;
Italy;EU;Milano polimi;Computer Engineering;Master;https://www.polimi.it/corsi/corsi-di-laurea-magistrale/M/2022-ing-ind-inf-magord-270-mi-481-computer-science-and-engineering-ingegneria-informatica;Software Engineering 2;1;https://www4.ceda.polimi.it/manifesti/manifesti/controller/ManifestoPublic.do?EVN_DETTAGLIO_RIGA_MANIFESTO=evento&aa=2022&k_cf=225&k_corso_la=481&k_indir=T2A&codDescr=054443&lang=IT&semestre=1&anno_corso=1&idItemOfferta=161169&idRiga=286941;CE;5;Both;50;30;20;NSt;Project,Open Questions,Discussion;English;;X;;;;;;;;;;;;;;;;;;;;;;;;;;;;;;;;;;;;;;;;;;;X;;;;;;;;;;;;;;;;;;;
Italy;EU;Torino Politecnico polito;Computer Engineering;Master;https://didattica.polito.it/pls/portal30/sviluppo.offerta_formativa_2019.vis?p_a_acc=2023&p_sdu=37&p_cds=18;Software Engineering;1;https://didattica.polito.it/pls/portal30/gap.pkg_guide.viewGap?p_cod_ins=04GSPOV&p_a_acc=2023&p_header=S&p_lang=&multi=N;CE;8;Both ;80;68;12;NSt;Open questions;English;;X;;;;;;;;;;;;;X;;;;;;;;;;;;;;;;;;;;;;;;;;;;;;?;;;;;;;;;;;;;;;;;;;
Italy;EU;Salerno unisa;Computer Science;Master;https://corsi.unisa.it/informatica-magistrale/didattica/insegnamenti;Management and Evolution of Software Projects;1;https://docenti.unisa.it/003241/en/teaching?anno=2022&id=511226&cId=10000-2016&pId=N0*N0*S2;CE;9;Both ;72;N/A;N/A;NSt;Project,Discussion;Italian;;X;;;;;;;;;;;;;;X;;;;;;;;;;;;;;;;;;;;;;x;;;;;;;X;;;;;;;;;;;;;;;;;;;
Italy;EU;Milano polimi;Computer Engineering;Master;https://www.polimi.it/corsi/corsi-di-laurea-magistrale/M/2022-ing-ind-inf-magord-270-mi-481-computer-science-and-engineering-ingegneria-informatica;Software Engineering 2;1;https://www4.ceda.polimi.it/manifesti/manifesti/controller/ManifestoPublic.do?EVN_DETTAGLIO_RIGA_MANIFESTO=evento&aa=2022&k_cf=225&k_corso_la=481&k_indir=T2A&codDescr=054443&lang=IT&semestre=1&anno_corso=1&idItemOfferta=161169&idRiga=286941;CE;5;Both;50;30;20;NSt;Project,Open Questions,Discussion;English;;X;;;;;;;;;;;;;;;;;;;;;;;;;;;;;;;;;;;;;;;;;;;X;;;;;;;;;;;;;;;;;;;
